{
  "backupResultID": "example",
  "status": "SUCCEEDED",
  "backupRecord": {
    "backupRecordID": "example",
    "sourceDocument": {
      "documentID": "example",
      "role": "OBSERVED",
      "canonicalHash": "example",
      "sourceReference": "example"
    },
    "sourceHash": "example",
    "storageReference": "example",
    "diagnosticReference": {
      "diagnosticID": "example",
      "chainRootReference": "example",
      "diagnosticKind": "STATE_VALIDITY",
      "ruleReferences": [
        {
          "ruleID": "ASH-STATE-VALIDITY-001",
          "sourceReference": "example",
          "ruleFamily": "example"
        }
      ]
    }
  },
  "diagnosticReference": {
    "diagnosticID": "example",
    "chainRootReference": "example",
    "diagnosticKind": "STATE_VALIDITY",
    "ruleReferences": [
      {
        "ruleID": "ASH-STATE-VALIDITY-001",
        "sourceReference": "example",
        "ruleFamily": "example"
      }
    ]
  }
}
